{
  "case_id": "NAT-01-rock-kick",
  "case_spec_sha256": "49a57fd109336fbd4fecbf7d89f9b75c08e0078dc0fa2a7fd6f62a0d6d62ea95",
  "contact_policy": {
    "allowed": [
      [
        "go2_feet",
        "rock"
      ],
      [
        "rock",
        "canyon_terrain"
      ],
      [
        "go2_feet",
        "canyon_terrain"
      ]
    ],
    "forbidden": [
      [
        "go2_base",
        "rock"
      ]
    ],
    "groups": {
      "canyon_terrain": {
        "geoms": [
          "terrain_*"
        ]
      },
      "go2_base": {
        "bodies": [
          "base"
        ]
      },
      "go2_feet": {
        "geoms": [
          "FL",
          "FR",
          "RL",
          "RR"
        ]
      },
      "rock": {
        "bodies": [
          "stone"
        ]
      }
    },
    "penetration_exemptions": []
  },
  "event_dag": {
    "edges": [
      [
        "foot_rock_contact",
        "rock_displaced"
      ],
      [
        "rock_displaced",
        "rock_settled"
      ]
    ],
    "nodes": [
      "foot_rock_contact",
      "rock_displaced",
      "rock_settled"
    ]
  },
  "gold_visibility": "development_private_placeholder",
  "initialization": {
    "keyframe": "m2_init"
  },
  "integrity_rules": {
    "allow_benchmark_grasp_api": false,
    "allow_static_field_adapter": false,
    "forbid_probe_model_handle": true,
    "forbid_qpos_qvel_write": true,
    "forbid_runtime_model_mutation": true
  },
  "perturbations": {
    "401": {},
    "409": {
      "body_geom_friction_scale": {
        "stone": 0.95
      },
      "body_mass_scale": {
        "stone": 0.95
      },
      "body_xy_offset_m": {
        "base": [
          0.01,
          -0.01
        ]
      },
      "body_yaw_offset_rad": {
        "base": 0.015
      }
    },
    "419": {
      "body_geom_friction_scale": {
        "stone": 1.05
      },
      "body_mass_scale": {
        "stone": 1.05
      },
      "body_xy_offset_m": {
        "base": [
          -0.012,
          0.008
        ]
      },
      "body_yaw_offset_rad": {
        "base": -0.02
      }
    },
    "421": {
      "body_geom_friction_scale": {
        "stone": 1.08
      },
      "body_mass_scale": {
        "stone": 0.9
      },
      "body_xy_offset_m": {
        "base": [
          0.0,
          0.015
        ]
      }
    },
    "431": {
      "body_geom_friction_scale": {
        "stone": 0.92
      },
      "body_mass_scale": {
        "stone": 1.1
      },
      "body_xy_offset_m": {
        "base": [
          0.008,
          0.012
        ]
      },
      "body_yaw_offset_rad": {
        "base": 0.012
      }
    }
  },
  "regions": {
    "goal": {
      "minimum_planar_displacement_m": 0.03,
      "type": "relative_displacement"
    }
  },
  "review": {
    "adjudicated": false,
    "formal_annotator_count": 0,
    "note": "The rock is explicitly bound to the 0.07-scale source boulder named in dynamics_program.json.",
    "official_use": false,
    "status": "development_frozen",
    "thresholds_frozen_before_reference_runs": true
  },
  "schema_version": "simcode4d.rc3a-dev1.case-gold",
  "thresholds": {
    "illegal_penetration_m": 0.001,
    "maximum_terminal_speed_mps": 0.05,
    "minimum_planar_displacement_m": 0.03,
    "terminal_hold_s": 0.5
  }
}
