{
  "case_id": "URB-03-pole-blocking",
  "case_spec_sha256": "8d3ad56cb603555357fee49d987006db84ce73107d419765815eec7aa86f5ea4",
  "contact_policy": {
    "allowed": [
      [
        "go2_feet",
        "floor"
      ],
      [
        "go2_all",
        "target_pole"
      ]
    ],
    "forbidden": [
      [
        "go2_base",
        "non_target_static"
      ]
    ],
    "groups": {
      "floor": {
        "geoms": [
          "terrain_*"
        ]
      },
      "go2_all": {
        "bodies": [
          "base",
          "FL_*",
          "FR_*",
          "RL_*",
          "RR_*"
        ]
      },
      "go2_base": {
        "bodies": [
          "base"
        ]
      },
      "go2_feet": {
        "geoms": [
          "FL",
          "FR",
          "RL",
          "RR"
        ]
      },
      "non_target_static": {
        "geoms": [
          "prop_convex_small_000_*",
          "prop_convex_small_001_*",
          "prop_convex_small_002_*"
        ]
      },
      "static_obstacles": {
        "geoms": [
          "prop_*"
        ]
      },
      "target_pole": {
        "geoms": [
          "prop_convex_small_017_lt_n4_pole"
        ]
      }
    },
    "penetration_exemptions": []
  },
  "event_dag": {
    "edges": [
      [
        "approach",
        "target_pole_contact"
      ],
      [
        "target_pole_contact",
        "blocked"
      ],
      [
        "blocked",
        "stop"
      ]
    ],
    "nodes": [
      "approach",
      "target_pole_contact",
      "blocked",
      "stop"
    ]
  },
  "gold_visibility": "development_private_placeholder",
  "initialization": {
    "keyframe": "m2_init"
  },
  "integrity_rules": {
    "allow_benchmark_grasp_api": false,
    "allow_static_field_adapter": false,
    "forbid_probe_model_handle": true,
    "forbid_qpos_qvel_write": true,
    "forbid_runtime_model_mutation": true
  },
  "perturbations": {
    "401": {},
    "409": {
      "body_geom_friction_scale": {
        "base": 0.95
      },
      "body_xy_offset_m": {
        "base": [
          0.01,
          -0.01
        ]
      },
      "body_yaw_offset_rad": {
        "base": 0.015
      }
    },
    "419": {
      "body_geom_friction_scale": {
        "base": 1.05
      },
      "body_xy_offset_m": {
        "base": [
          -0.012,
          0.008
        ]
      },
      "body_yaw_offset_rad": {
        "base": -0.02
      }
    },
    "421": {
      "body_geom_friction_scale": {
        "base": 1.08
      },
      "body_xy_offset_m": {
        "base": [
          0.0,
          0.015
        ]
      }
    },
    "431": {
      "body_geom_friction_scale": {
        "base": 0.92
      },
      "body_xy_offset_m": {
        "base": [
          0.008,
          0.012
        ]
      },
      "body_yaw_offset_rad": {
        "base": 0.012
      }
    }
  },
  "regions": {
    "target_pole": {
      "center_xyz_m": [
        4.0,
        4.5,
        2.3
      ],
      "geom": "prop_convex_small_017_lt_n4_pole",
      "type": "fixed_geom"
    }
  },
  "review": {
    "adjudicated": false,
    "formal_annotator_count": 0,
    "note": "Development-only benchmark-authored semantics; source evidence is retained, thresholds are frozen before the reference matrix, and official Core15 admission remains false.",
    "official_use": false,
    "status": "development_frozen",
    "thresholds_frozen_before_reference_runs": true
  },
  "schema_version": "simcode4d.rc3a-dev1.case-gold",
  "thresholds": {
    "illegal_penetration_m": 0.001,
    "maximum_base_x_m": 3.95,
    "maximum_lateral_span_m": 0.4,
    "maximum_terminal_speed_mps": 0.15,
    "maximum_tilt_rad": 0.7,
    "minimum_approach_m": 2.7,
    "terminal_hold_s": 0.5
  }
}
