{
  "case_id": "IND-02-go2-living-room",
  "case_spec_sha256": "99dd4fdfffb970638d0fdc4afcbf0ec024de701cd77c80f1fb2d3c9a8acee58c",
  "contact_policy": {
    "allowed": [
      [
        "go2_feet",
        "floor"
      ]
    ],
    "forbidden": [
      [
        "go2_base",
        "static_obstacles"
      ]
    ],
    "groups": {
      "floor": {
        "geoms": [
          "floor_*"
        ]
      },
      "go2_all": {
        "bodies": [
          "base",
          "FL_*",
          "FR_*",
          "RL_*",
          "RR_*"
        ]
      },
      "go2_base": {
        "bodies": [
          "base"
        ]
      },
      "go2_feet": {
        "geoms": [
          "FL",
          "FR",
          "RL",
          "RR"
        ]
      },
      "static_obstacles": {
        "geoms": [
          "wall_*",
          "lr_wall_*",
          "prop_*"
        ]
      }
    },
    "penetration_exemptions": []
  },
  "event_dag": {
    "edges": [
      [
        "forward_progress",
        "goal_entry"
      ],
      [
        "goal_entry",
        "stop"
      ]
    ],
    "nodes": [
      "forward_progress",
      "goal_entry",
      "stop"
    ]
  },
  "gold_visibility": "development_private_placeholder",
  "initialization": {
    "keyframe": "m2_init"
  },
  "integrity_rules": {
    "allow_benchmark_grasp_api": false,
    "allow_static_field_adapter": false,
    "forbid_probe_model_handle": true,
    "forbid_qpos_qvel_write": true,
    "forbid_runtime_model_mutation": true
  },
  "perturbations": {
    "401": {},
    "409": {
      "body_geom_friction_scale": {
        "base": 0.95
      },
      "body_xy_offset_m": {
        "base": [
          0.01,
          -0.01
        ]
      },
      "body_yaw_offset_rad": {
        "base": 0.015
      }
    },
    "419": {
      "body_geom_friction_scale": {
        "base": 1.05
      },
      "body_xy_offset_m": {
        "base": [
          -0.012,
          0.008
        ]
      },
      "body_yaw_offset_rad": {
        "base": -0.02
      }
    },
    "421": {
      "body_geom_friction_scale": {
        "base": 1.08
      },
      "body_xy_offset_m": {
        "base": [
          0.0,
          0.015
        ]
      }
    },
    "431": {
      "body_geom_friction_scale": {
        "base": 0.92
      },
      "body_xy_offset_m": {
        "base": [
          0.008,
          0.012
        ]
      },
      "body_yaw_offset_rad": {
        "base": 0.012
      }
    }
  },
  "regions": {
    "goal": {
      "max_xyz_m": [
        5.4,
        6.75,
        0.75
      ],
      "min_xyz_m": [
        4.9,
        5.85,
        0.15
      ],
      "type": "aabb"
    }
  },
  "review": {
    "adjudicated": false,
    "formal_annotator_count": 0,
    "note": "Development-only benchmark-authored semantics; source evidence is retained, thresholds are frozen before the reference matrix, and official Core15 admission remains false.",
    "official_use": false,
    "status": "development_frozen",
    "thresholds_frozen_before_reference_runs": true
  },
  "schema_version": "simcode4d.rc3a-dev1.case-gold",
  "thresholds": {
    "illegal_penetration_m": 0.001,
    "maximum_height_span_m": 0.2,
    "maximum_lateral_span_m": 0.3,
    "maximum_terminal_speed_mps": 0.15,
    "maximum_tilt_rad": 0.65,
    "minimum_travel_m": 2.2,
    "terminal_hold_s": 0.5
  }
}
